[
  {
    "id": "cmd.palette.open",
    "name": "Open palette",
    "safetyClass": "safe",
    "executionMode": "immediate",
    "supportsHotkey": true,
    "supportsPalette": true,
    "supportsVirtualized": false,
    "defaultHotkey": "NVDA+Shift+P",
    "requiresConfirmation": false,
    "fallbackCommandIds": []
  },
  {
    "id": "cmd.integration.itemChooser.open",
    "name": "Open Screen Item Chooser",
    "safetyClass": "safe",
    "executionMode": "immediate",
    "supportsHotkey": true,
    "supportsPalette": true,
    "supportsVirtualized": false,
    "defaultHotkey": "Grave+O",
    "requiresConfirmation": false,
    "fallbackCommandIds": [
      "cmd.palette.open"
    ]
  },
  {
    "id": "cmd.integration.glow.health",
    "name": "GLOW server health check",
    "safetyClass": "safe",
    "executionMode": "immediate",
    "supportsHotkey": true,
    "supportsPalette": true,
    "supportsVirtualized": false,
    "defaultHotkey": "Grave+Y",
    "requiresConfirmation": false,
    "fallbackCommandIds": []
  },
  {
    "id": "cmd.integration.glow.audit",
    "name": "GLOW audit document",
    "safetyClass": "safe",
    "executionMode": "immediate",
    "supportsHotkey": true,
    "supportsPalette": true,
    "supportsVirtualized": false,
    "defaultHotkey": "Grave+E",
    "requiresConfirmation": false,
    "fallbackCommandIds": []
  },
  {
    "id": "cmd.integration.glow.fix",
    "name": "GLOW fix document",
    "safetyClass": "mutating",
    "executionMode": "immediate",
    "supportsHotkey": true,
    "supportsPalette": true,
    "supportsVirtualized": false,
    "defaultHotkey": "Grave+Shift+V",
    "requiresConfirmation": false,
    "fallbackCommandIds": []
  },
  {
    "id": "cmd.integration.glow.convert",
    "name": "GLOW convert document",
    "safetyClass": "safe",
    "executionMode": "immediate",
    "supportsHotkey": true,
    "supportsPalette": true,
    "supportsVirtualized": false,
    "defaultHotkey": "Grave+Shift+K",
    "requiresConfirmation": false,
    "fallbackCommandIds": []
  },
  {
    "id": "cmd.integration.glow.report",
    "name": "GLOW report document",
    "safetyClass": "safe",
    "executionMode": "immediate",
    "supportsHotkey": true,
    "supportsPalette": true,
    "supportsVirtualized": false,
    "defaultHotkey": "Grave+Shift+L",
    "requiresConfirmation": false,
    "fallbackCommandIds": []
  },
  {
    "id": "cmd.integration.itemChooser.openOcr",
    "name": "Open Screen Item Chooser with OCR",
    "safetyClass": "safe",
    "executionMode": "immediate",
    "supportsHotkey": true,
    "supportsPalette": true,
    "supportsVirtualized": false,
    "defaultHotkey": "Grave+Shift+O",
    "requiresConfirmation": false,
    "fallbackCommandIds": [
      "cmd.integration.itemChooser.open",
      "cmd.palette.open"
    ]
  },
  {
    "id": "cmd.capture.quickInbox",
    "name": "Quick capture to inbox",
    "safetyClass": "safe",
    "executionMode": "immediate",
    "supportsHotkey": true,
    "supportsPalette": true,
    "supportsVirtualized": false,
    "defaultHotkey": "Grave+Q",
    "requiresConfirmation": false,
    "fallbackCommandIds": [
      "cmd.palette.open"
    ]
  },
  {
    "id": "cmd.capture.quickInbox.route",
    "name": "Route quick capture item",
    "safetyClass": "mutating",
    "executionMode": "immediate",
    "supportsHotkey": false,
    "supportsPalette": true,
    "supportsVirtualized": false,
    "defaultHotkey": "",
    "requiresConfirmation": false,
    "fallbackCommandIds": []
  },
  {
    "id": "cmd.capture.quickInbox.list",
    "name": "List quick capture items",
    "safetyClass": "safe",
    "executionMode": "immediate",
    "supportsHotkey": false,
    "supportsPalette": true,
    "supportsVirtualized": false,
    "defaultHotkey": "",
    "requiresConfirmation": false,
    "fallbackCommandIds": []
  },
  {
    "id": "cmd.journal.list",
    "name": "List operation journal",
    "safetyClass": "safe",
    "executionMode": "immediate",
    "supportsHotkey": false,
    "supportsPalette": true,
    "supportsVirtualized": false,
    "defaultHotkey": "",
    "requiresConfirmation": false,
    "fallbackCommandIds": []
  },
  {
    "id": "cmd.journal.rollback",
    "name": "Rollback journal entry",
    "safetyClass": "mutating",
    "executionMode": "immediate",
    "supportsHotkey": false,
    "supportsPalette": true,
    "supportsVirtualized": false,
    "defaultHotkey": "",
    "requiresConfirmation": true,
    "fallbackCommandIds": []
  },
  {
    "id": "cmd.journal.undoLast",
    "name": "Undo last reversible action",
    "safetyClass": "mutating",
    "executionMode": "immediate",
    "supportsHotkey": true,
    "supportsPalette": true,
    "supportsVirtualized": false,
    "defaultHotkey": "Grave+Shift+J",
    "requiresConfirmation": false,
    "fallbackCommandIds": []
  },
  {
    "id": "cmd.journal.rollbackCoverage",
    "name": "Rollback coverage report",
    "safetyClass": "safe",
    "executionMode": "immediate",
    "supportsHotkey": false,
    "supportsPalette": true,
    "supportsVirtualized": false,
    "defaultHotkey": "",
    "requiresConfirmation": false,
    "fallbackCommandIds": []
  },
  {
    "id": "cmd.selection.summarize",
    "name": "Summarize selection",
    "safetyClass": "adaptive",
    "executionMode": "preview-first",
    "supportsHotkey": true,
    "supportsPalette": true,
    "supportsVirtualized": true,
    "defaultHotkey": "Grave+S",
    "requiresConfirmation": false,
    "fallbackCommandIds": [
      "cmd.result.openFallbacks",
      "cmd.palette.open"
    ]
  },
  {
    "id": "cmd.selection.extractActions",
    "name": "Extract action items",
    "safetyClass": "adaptive",
    "executionMode": "preview-first",
    "supportsHotkey": true,
    "supportsPalette": true,
    "supportsVirtualized": true,
    "defaultHotkey": "Grave+A",
    "requiresConfirmation": false,
    "fallbackCommandIds": [
      "cmd.result.openFallbacks",
      "cmd.palette.open"
    ]
  },
  {
    "id": "cmd.selection.rewriteBeginner",
    "name": "Rewrite for beginners",
    "safetyClass": "mutating",
    "executionMode": "preview-first",
    "supportsHotkey": true,
    "supportsPalette": true,
    "supportsVirtualized": true,
    "defaultHotkey": "Grave+R",
    "requiresConfirmation": true,
    "fallbackCommandIds": [
      "cmd.palette.open"
    ]
  },
  {
    "id": "cmd.result.virtualOpen",
    "name": "Open latest virtualized result",
    "safetyClass": "safe",
    "executionMode": "immediate",
    "supportsHotkey": true,
    "supportsPalette": true,
    "supportsVirtualized": true,
    "defaultHotkey": "Grave+V",
    "requiresConfirmation": false,
    "fallbackCommandIds": [
      "cmd.palette.open"
    ]
  },
  {
    "id": "cmd.result.block.copy",
    "name": "Copy current virtual block",
    "safetyClass": "safe",
    "executionMode": "immediate",
    "supportsHotkey": true,
    "supportsPalette": false,
    "supportsVirtualized": true,
    "defaultHotkey": "Grave+C",
    "requiresConfirmation": false,
    "fallbackCommandIds": [
      "cmd.result.copyAll"
    ]
  },
  {
    "id": "cmd.result.block.next",
    "name": "Next virtual block",
    "safetyClass": "safe",
    "executionMode": "immediate",
    "supportsHotkey": true,
    "supportsPalette": false,
    "supportsVirtualized": true,
    "defaultHotkey": "Grave+RightArrow",
    "requiresConfirmation": false,
    "fallbackCommandIds": []
  },
  {
    "id": "cmd.result.block.previous",
    "name": "Previous virtual block",
    "safetyClass": "safe",
    "executionMode": "immediate",
    "supportsHotkey": true,
    "supportsPalette": false,
    "supportsVirtualized": true,
    "defaultHotkey": "Grave+LeftArrow",
    "requiresConfirmation": false,
    "fallbackCommandIds": []
  },
  {
    "id": "cmd.context.returnSource",
    "name": "Return to source anchor",
    "safetyClass": "safe",
    "executionMode": "immediate",
    "supportsHotkey": true,
    "supportsPalette": true,
    "supportsVirtualized": true,
    "defaultHotkey": "Grave+Backspace",
    "requiresConfirmation": false,
    "fallbackCommandIds": [
      "cmd.palette.open"
    ]
  },
  {
    "id": "cmd.help.availableHotkeys",
    "name": "What can I press",
    "safetyClass": "safe",
    "executionMode": "immediate",
    "supportsHotkey": true,
    "supportsPalette": true,
    "supportsVirtualized": false,
    "defaultHotkey": "Grave+Slash",
    "requiresConfirmation": false,
    "fallbackCommandIds": []
  },
  {
    "id": "cmd.system.emergencyStop",
    "name": "Emergency stop",
    "safetyClass": "safe",
    "executionMode": "immediate",
    "supportsHotkey": true,
    "supportsPalette": true,
    "supportsVirtualized": true,
    "defaultHotkey": "Grave+Escape",
    "requiresConfirmation": false,
    "fallbackCommandIds": []
  },
  {
    "id": "cmd.result.copyAll",
    "name": "Copy full result",
    "safetyClass": "safe",
    "executionMode": "immediate",
    "supportsHotkey": true,
    "supportsPalette": true,
    "supportsVirtualized": true,
    "defaultHotkey": "Grave+Shift+C",
    "requiresConfirmation": false,
    "fallbackCommandIds": []
  },
  {
    "id": "cmd.result.pinInbox",
    "name": "Pin result to inbox",
    "safetyClass": "safe",
    "executionMode": "immediate",
    "supportsHotkey": true,
    "supportsPalette": true,
    "supportsVirtualized": true,
    "defaultHotkey": "Grave+P",
    "requiresConfirmation": false,
    "fallbackCommandIds": []
  },
  {
    "id": "cmd.result.readConfidence",
    "name": "Read confidence summary",
    "safetyClass": "safe",
    "executionMode": "immediate",
    "supportsHotkey": true,
    "supportsPalette": true,
    "supportsVirtualized": true,
    "defaultHotkey": "Grave+K",
    "requiresConfirmation": false,
    "fallbackCommandIds": []
  },
  {
    "id": "cmd.result.openFallbacks",
    "name": "Open fallback menu",
    "safetyClass": "safe",
    "executionMode": "immediate",
    "supportsHotkey": true,
    "supportsPalette": true,